{
  "$schema": "http://json-schema.org/draft-07/schema#",
  "type": ["object", "null"],
  "title": "Mouse Schema",
  "description": "Schema for Mouse components",
  "required": ["metadata"],
  "properties": {
    "opendb_id": {
      "type": ["string", "null"],
      "description": "Unique identifier for the document (UUID v4)"
    },
    "weight": {
      "description": "Product weight in grams for one complete, usable unit of this exact variant. Exclude retail packaging, shipping materials, multipack totals, and load capacity. Leave unset when the product is digital, the weight is unknown, or the source does not clearly identify product weight. Use the mouse's standard usable configuration for the exact variant.",
      "type": ["number", "null"],
      "exclusiveMinimum": 0
    },
    "dimensions": {
      "description": "Mouse dimensions",
      "type": ["object", "null"],
      "properties": {
        "length": {
          "description": "Length in millimeters",
          "type": ["number", "null"]
        },
        "width": {
          "description": "Width in millimeters",
          "type": ["number", "null"]
        },
        "height": {
          "description": "Height in millimeters",
          "type": ["number", "null"]
        }
      }
    },
    "size": {
      "description": "Legacy subjective size category. Keep existing values during migration; do not populate for new mice because there are no stable size thresholds.",
      "type": ["string", "null"],
      "enum": ["Small", "Medium", "Large", null]
    },
    "shape": {
      "description": "Physical shell shape: Symmetrical, Ergonomic, or Vertical. Shape does not determine which hand can use every control; record that in Handedness. Ambidextrous is retained only for existing records pending migration; do not select it for new data.",
      "type": ["string", "null"],
      "enum": ["Symmetrical", "Ergonomic", "Vertical", "Ambidextrous", null]
    },
    "handedness": {
      "description": "Which hand can use the mouse's intended controls for the exact model: Right-handed, Left-handed, or Ambidextrous. A symmetrical shell alone does not prove ambidextrous controls.",
      "type": ["string", "null"],
      "enum": ["Right-handed", "Left-handed", "Ambidextrous", null]
    },
    "connectivity": {
      "description": "How the mouse sends input to the computer. For wired data, choose the connector at the computer end: a USB-C-to-USB-A cable is Wired USB-A when USB-A plugs into the computer. A charging-only cable does not count as wired; a USB receiver is Wireless 2.4GHz. Generic Wired is retained only for existing records and must not be selected for new data.",
      "type": ["array", "null"],
      "items": {
        "type": "string",
        "enum": ["Wired", "Wired USB-A", "Wired USB-C", "Wireless 2.4GHz", "Bluetooth"]
      }
    },
    "sensor": {
      "description": "Sensor model (e.g., 'PixArt PAW3395', 'Razer Focus Pro 30K')",
      "type": ["string", "null"]
    },
    "max_dpi": {
      "description": "Maximum DPI/CPI setting",
      "type": ["number", "null"]
    },
    "polling_rate": {
      "description": "Highest officially supported polling rate in Hz for this exact mouse. Keep any receiver, accessory, or mode condition in the source evidence; do not add a second rate or infer one from a related SKU.",
      "type": ["number", "null"]
    },
    "buttons": {
      "description": "Number of programmable buttons",
      "type": ["number", "null"]
    },
    "switches": {
      "description": "Manufacturer's exact main-button switch model, such as Kailh GM 8.0; use Switch Type for the actuation technology.",
      "type": ["string", "null"]
    },
    "switch_type": {
      "description": "Main-button switch actuation technology: Mechanical, Optical, Hybrid, or Inductive. Leave empty when the exact technology is not sourced; use Switches for the named switch model.",
      "type": ["string", "null"],
      "enum": ["Mechanical", "Optical", "Hybrid", "Inductive", null]
    },
    "onboard_memory": {
      "description": "Whether the mouse has onboard memory for storing profiles",
      "type": ["boolean", "null"]
    },
    "rgb": {
      "description": "Legacy RGB flag retained for old records. Use Lighting for new data; do not populate this duplicate field.",
      "type": ["boolean", "null"]
    },
    "lighting": {
      "description": "Lighting capabilities for this product. Use RGB for non-addressable RGB, ARGB for addressable RGB, Multicolor for non-RGB multi-color lighting, Fixed for a single fixed lighting color, None when the product has no lighting, Display for configurable displays, and Fixed Color Display for displays limited to fixed colors such as black and white. Record the mouse's actual lighting capabilities. Select None only with affirmative evidence.",
      "type": ["array", "null"],
      "items": {
        "type": "string",
        "enum": ["RGB", "ARGB", "Multicolor", "Fixed", "None", "Display", "Fixed Color Display"]
      }
    },
    "battery_life": {
      "description": "Battery life in hours (for wireless mice)",
      "type": ["number", "null"]
    },
    "battery_type": {
      "description": "Type of battery (Rechargeable, AA, AAA)",
      "type": ["string", "null"],
      "enum": ["Rechargeable", "AA", "AAA", null]
    },
    "grip_types": {
      "description": "Manufacturer-recommended grip styles for the exact mouse: Palm, Claw, or Fingertip. Do not infer from shell shape or dimensions.",
      "type": ["array", "null"],
      "items": {
        "type": "string",
        "enum": ["Palm", "Claw", "Fingertip"]
      }
    },
    "silent_clicks": {
      "description": "Whether the mouse has silent/quiet clicks (useful for office environments)",
      "type": ["boolean", "null"]
    },
    "general_product_information": {
      "type": ["object", "null"],
      "description": "General product information and retailer SKUs",
      "properties": {
        "amazon_sku": {
          "type": ["string", "null"],
          "description": "Amazon product SKU"
        },
        "newegg_sku": {
          "type": ["string", "null"],
          "description": "Newegg product SKU"
        },
        "bestbuy_sku": {
          "type": ["number", "null"],
          "description": "Best Buy product SKU"
        },
        "walmart_sku": {
          "type": ["number", "null"],
          "description": "Walmart product SKU"
        },
        "adorama_sku": {
          "type": ["string", "null"],
          "description": "Adorama product SKU"
        },
        "ibuypower_sku": {
          "type": ["string", "null"],
          "description": "iBuyPower product SKU"
        },
        "hyte_sku": {
          "type": ["string", "null"],
          "description": "HYTE product SKU"
        },
        "lttstore_sku": {
          "type": ["string", "null"],
          "description": "LTTStore product SKU"
        },
        "manufacturer_url": {
          "type": ["string", "null"],
          "description": "Official manufacturer product URL"
        }
      }
    },
    "metadata": {
      "type": ["object", "null"],
      "properties": {
        "name": {
          "description": "Full product name",
          "type": ["string", "null"]
        },
        "manufacturer": {
          "description": "Mouse manufacturer",
          "type": ["string", "null"]
        },
        "part_numbers": {
          "description": "Array of manufacturer's part numbers/SKUs",
          "type": ["array", "null"],
          "items": {
            "type": "string"
          }
        },
        "series": {
          "description": "Product series name",
          "type": ["string", "null"]
        },
        "variant": {
          "description": "Specific variant in the series",
          "type": ["string", "null"]
        },
        "releaseYear": {
          "description": "Year of release",
          "type": ["number", "null"]
        },
        "last_manually_spec_verified_at": {
          "type": ["string", "null"],
          "format": "date-time",
          "description": "ISO 8601 timestamp of when the part specs were last manually verified by a human"
        }
      },
      "required": ["name"]
    },
    "identifiers": {
      "type": "object",
      "properties": {
        "version": {
          "type": "integer",
          "exclusiveMinimum": 0,
          "maximum": 9007199254740991,
          "description": "Monotonically increasing identity snapshot version"
        },
        "identifiers": {
          "type": "array",
          "items": {
            "type": "object",
            "properties": {
              "type": {
                "type": "string",
                "enum": ["upc", "ean", "gtin", "mpn"]
              },
              "value": {
                "type": "string",
                "minLength": 1
              },
              "region": {
                "default": "all",
                "type": "string",
                "minLength": 1
              }
            },
            "required": ["type", "value", "region"],
            "additionalProperties": false
          },
          "description": "Canonical product identifiers"
        },
        "retailer_listings": {
          "type": "array",
          "items": {
            "type": "object",
            "properties": {
              "source": {
                "type": "string",
                "minLength": 1
              },
              "channel": {
                "type": "string",
                "minLength": 1
              },
              "source_product_id": {
                "type": "string",
                "minLength": 1
              },
              "pricing_enabled": {
                "type": "boolean"
              },
              "excluded_source_offer_ids": {
                "type": "array",
                "items": {
                  "type": "string",
                  "minLength": 1,
                  "maxLength": 512
                }
              },
              "verified": {
                "type": "boolean"
              }
            },
            "required": ["source", "channel", "source_product_id", "pricing_enabled", "verified"],
            "additionalProperties": false
          },
          "description": "Canonical retailer product listings used for pricing"
        }
      },
      "required": ["version", "identifiers", "retailer_listings"],
      "additionalProperties": false,
      "description": "Current versioned product identity snapshot used for retailer and pricing matching"
    }
  }
}
