{
  "opendb_id": "d3b3986c-be0e-499c-81e8-d30c9e62dca8",
  "connectivity": [],
  "lighting": [],
  "grip_types": [],
  "metadata": {
    "name": "HP 285 Silent Wireless/Wired Optical Mouse",
    "manufacturer": "HP",
    "part_numbers": ["6G4E6AAABL"]
  },
  "general_product_information": {},
  "identifiers": {
    "version": 1,
    "identifiers": [
      {
        "type": "mpn",
        "value": "6G4E6AAABL",
        "region": "all"
      }
    ],
    "retailer_listings": []
  }
}
