{
  "opendb_id": "25c9d9bd-1fd1-4aa4-b135-0df56bfdca1f",
  "connectivity": [],
  "lighting": [],
  "grip_types": [],
  "metadata": {
    "name": "Dell MS3220 Wired Laser Mouse",
    "manufacturer": "Dell",
    "part_numbers": ["MS3220", "570-ABHN", "YP11M", "MS3220-BLK", "570-ABDY"]
  },
  "general_product_information": {},
  "identifiers": {
    "version": 1,
    "identifiers": [
      {
        "type": "ean",
        "value": "0884116366737",
        "region": "all"
      },
      {
        "type": "ean",
        "value": "0884116366744",
        "region": "all"
      },
      {
        "type": "ean",
        "value": "5397184289105",
        "region": "all"
      },
      {
        "type": "ean",
        "value": "5704174842132",
        "region": "all"
      },
      {
        "type": "ean",
        "value": "5715063202814",
        "region": "all"
      },
      {
        "type": "ean",
        "value": "5715063601273",
        "region": "all"
      },
      {
        "type": "ean",
        "value": "5715063800614",
        "region": "all"
      },
      {
        "type": "mpn",
        "value": "570-ABDY",
        "region": "all"
      },
      {
        "type": "mpn",
        "value": "570-ABHN",
        "region": "all"
      },
      {
        "type": "mpn",
        "value": "MS3220",
        "region": "all"
      },
      {
        "type": "mpn",
        "value": "MS3220-BLK",
        "region": "all"
      },
      {
        "type": "mpn",
        "value": "YP11M",
        "region": "all"
      },
      {
        "type": "upc",
        "value": "884116366737",
        "region": "all"
      },
      {
        "type": "upc",
        "value": "884116366744",
        "region": "all"
      }
    ],
    "retailer_listings": [
      {
        "source": "alternate",
        "channel": "de",
        "source_product_id": "1615762",
        "pricing_enabled": true,
        "verified": false
      },
      {
        "source": "alternate",
        "channel": "es",
        "source_product_id": "1615762",
        "pricing_enabled": true,
        "verified": false
      },
      {
        "source": "alternate",
        "channel": "fr",
        "source_product_id": "1615762",
        "pricing_enabled": true,
        "verified": false
      },
      {
        "source": "alternate",
        "channel": "it",
        "source_product_id": "1615762",
        "pricing_enabled": true,
        "verified": false
      },
      {
        "source": "amazon",
        "channel": "au",
        "source_product_id": "B084BRHWPM",
        "pricing_enabled": true,
        "verified": true
      },
      {
        "source": "amazon",
        "channel": "be",
        "source_product_id": "B084BRHWPM",
        "pricing_enabled": true,
        "verified": true
      },
      {
        "source": "amazon",
        "channel": "ca",
        "source_product_id": "B084BRHWPM",
        "pricing_enabled": true,
        "verified": true
      },
      {
        "source": "amazon",
        "channel": "de",
        "source_product_id": "B084BRHWPM",
        "pricing_enabled": true,
        "verified": true
      },
      {
        "source": "amazon",
        "channel": "es",
        "source_product_id": "B084BRHWPM",
        "pricing_enabled": true,
        "verified": true
      },
      {
        "source": "amazon",
        "channel": "fr",
        "source_product_id": "B084BRHWPM",
        "pricing_enabled": true,
        "verified": true
      },
      {
        "source": "amazon",
        "channel": "ie",
        "source_product_id": "B084BRHWPM",
        "pricing_enabled": true,
        "verified": true
      },
      {
        "source": "amazon",
        "channel": "it",
        "source_product_id": "B084BRHWPM",
        "pricing_enabled": true,
        "verified": true
      },
      {
        "source": "amazon",
        "channel": "jp",
        "source_product_id": "B084BRHWPM",
        "pricing_enabled": true,
        "verified": true
      },
      {
        "source": "amazon",
        "channel": "nl",
        "source_product_id": "B084BRHWPM",
        "pricing_enabled": true,
        "verified": true
      },
      {
        "source": "amazon",
        "channel": "pl",
        "source_product_id": "B084BRHWPM",
        "pricing_enabled": true,
        "verified": true
      },
      {
        "source": "amazon",
        "channel": "se",
        "source_product_id": "B084BRHWPM",
        "pricing_enabled": true,
        "verified": true
      },
      {
        "source": "amazon",
        "channel": "sg",
        "source_product_id": "B084BRHWPM",
        "pricing_enabled": true,
        "verified": true
      },
      {
        "source": "amazon",
        "channel": "uk",
        "source_product_id": "B084BRHWPM",
        "pricing_enabled": true,
        "verified": true
      },
      {
        "source": "amazon",
        "channel": "us",
        "source_product_id": "B084BRHWPM",
        "pricing_enabled": true,
        "verified": true
      },
      {
        "source": "back-to-the-office",
        "channel": "uk",
        "source_product_id": "55307224121726",
        "pricing_enabled": true,
        "verified": false
      },
      {
        "source": "bhphoto",
        "channel": "us",
        "source_product_id": "DEMS3220BLK",
        "pricing_enabled": true,
        "verified": false
      },
      {
        "source": "box",
        "channel": "uk",
        "source_product_id": "MS3220-BLK",
        "pricing_enabled": true,
        "verified": false
      },
      {
        "source": "cenowarka",
        "channel": "pl",
        "source_product_id": "2245449",
        "pricing_enabled": true,
        "verified": false
      },
      {
        "source": "geizhals",
        "channel": "de",
        "source_product_id": "2245449",
        "pricing_enabled": true,
        "verified": false
      },
      {
        "source": "laptop-outlet",
        "channel": "uk",
        "source_product_id": "MS3220-BLK",
        "pricing_enabled": true,
        "verified": false
      },
      {
        "source": "mwave",
        "channel": "au",
        "source_product_id": "AC93295",
        "pricing_enabled": true,
        "verified": false
      },
      {
        "source": "proshop",
        "channel": "de",
        "source_product_id": "2832007",
        "pricing_enabled": true,
        "verified": false
      },
      {
        "source": "proshop",
        "channel": "fi",
        "source_product_id": "2832007",
        "pricing_enabled": true,
        "verified": false
      },
      {
        "source": "proshop",
        "channel": "nl",
        "source_product_id": "2832007",
        "pricing_enabled": true,
        "verified": false
      },
      {
        "source": "proshop",
        "channel": "pl",
        "source_product_id": "2832007",
        "pricing_enabled": true,
        "verified": false
      },
      {
        "source": "quzo",
        "channel": "uk",
        "source_product_id": "243731",
        "pricing_enabled": true,
        "verified": false
      },
      {
        "source": "ruedecommerce",
        "channel": "fr",
        "source_product_id": "MKR00003387611",
        "pricing_enabled": true,
        "verified": false
      },
      {
        "source": "skinflint",
        "channel": "uk",
        "source_product_id": "2245449",
        "pricing_enabled": true,
        "verified": false
      },
      {
        "source": "walmart",
        "channel": "us",
        "source_product_id": "352259983",
        "pricing_enabled": true,
        "verified": false
      }
    ]
  }
}
