{
  "opendb_id": "d77f4847-780c-44fe-96f7-89144a79a227",
  "connectivity": [],
  "lighting": [],
  "metadata": {
    "name": "Mad Catz R.A.T. 3 Wired Optical Mouse",
    "manufacturer": "Mad Catz",
    "part_numbers": ["MCB437030001", "04", "1"]
  },
  "general_product_information": {},
  "identifiers": {
    "version": 1,
    "identifiers": [
      {
        "type": "mpn",
        "value": "04",
        "region": "all"
      },
      {
        "type": "mpn",
        "value": "1",
        "region": "all"
      },
      {
        "type": "mpn",
        "value": "MCB437030001",
        "region": "all"
      }
    ],
    "retailer_listings": []
  }
}
