{
  "opendb_id": "b73a263c-e382-496d-b010-1d79e6e706df",
  "connectivity": ["Bluetooth", "Wired USB-C"],
  "lighting": [],
  "grip_types": [],
  "metadata": {
    "name": "EWEADN Q5 Wireless Mouse, Bluetooth & 2.4G Quiet Computer Mouses with Battery Level Display, 1600 DPI, Ergonomic Office Mouse, 6 Button Portable Cute Computer Mouse for Laptop/PC/Mac - Purple",
    "manufacturer": "SEUNKWANG",
    "part_numbers": []
  },
  "general_product_information": {},
  "identifiers": {
    "version": 1,
    "identifiers": [],
    "retailer_listings": [
      {
        "source": "amazon",
        "channel": "au",
        "source_product_id": "B0GQSKWJ7F",
        "pricing_enabled": true,
        "verified": true
      },
      {
        "source": "amazon",
        "channel": "be",
        "source_product_id": "B0GQSKWJ7F",
        "pricing_enabled": true,
        "verified": true
      },
      {
        "source": "amazon",
        "channel": "ca",
        "source_product_id": "B0GQSKWJ7F",
        "pricing_enabled": true,
        "verified": true
      },
      {
        "source": "amazon",
        "channel": "de",
        "source_product_id": "B0GQSKWJ7F",
        "pricing_enabled": true,
        "verified": true
      },
      {
        "source": "amazon",
        "channel": "es",
        "source_product_id": "B0GQSKWJ7F",
        "pricing_enabled": true,
        "verified": true
      },
      {
        "source": "amazon",
        "channel": "fr",
        "source_product_id": "B0GQSKWJ7F",
        "pricing_enabled": true,
        "verified": true
      },
      {
        "source": "amazon",
        "channel": "ie",
        "source_product_id": "B0GQSKWJ7F",
        "pricing_enabled": true,
        "verified": true
      },
      {
        "source": "amazon",
        "channel": "it",
        "source_product_id": "B0GQSKWJ7F",
        "pricing_enabled": true,
        "verified": true
      },
      {
        "source": "amazon",
        "channel": "jp",
        "source_product_id": "B0GQSKWJ7F",
        "pricing_enabled": true,
        "verified": true
      },
      {
        "source": "amazon",
        "channel": "nl",
        "source_product_id": "B0GQSKWJ7F",
        "pricing_enabled": true,
        "verified": true
      },
      {
        "source": "amazon",
        "channel": "pl",
        "source_product_id": "B0GQSKWJ7F",
        "pricing_enabled": true,
        "verified": true
      },
      {
        "source": "amazon",
        "channel": "se",
        "source_product_id": "B0GQSKWJ7F",
        "pricing_enabled": true,
        "verified": true
      },
      {
        "source": "amazon",
        "channel": "sg",
        "source_product_id": "B0GQSKWJ7F",
        "pricing_enabled": true,
        "verified": true
      },
      {
        "source": "amazon",
        "channel": "uk",
        "source_product_id": "B0GQSKWJ7F",
        "pricing_enabled": true,
        "verified": true
      },
      {
        "source": "amazon",
        "channel": "us",
        "source_product_id": "B0GQSKWJ7F",
        "pricing_enabled": true,
        "verified": true
      }
    ]
  }
}
