{
  "opendb_id": "de4c3148-2084-42cd-9d70-e040eaaee9a6",
  "connectivity": [],
  "lighting": [],
  "grip_types": [],
  "metadata": {
    "name": "Pulsar Xlite V2 Wireless Optical Gaming Mouse",
    "manufacturer": "Pulsar",
    "part_numbers": ["PXW23"]
  },
  "general_product_information": {},
  "identifiers": {
    "version": 1,
    "identifiers": [
      {
        "type": "mpn",
        "value": "PXW23",
        "region": "all"
      }
    ],
    "retailer_listings": []
  }
}
