{
  "opendb_id": "745dc7c4-7b2d-458c-968f-1fc6dcbf2a0c",
  "connectivity": [],
  "lighting": [],
  "grip_types": [],
  "metadata": {
    "name": "Mad Catz R.A.T. 9 Wireless Laser Mouse",
    "manufacturer": "Mad Catz",
    "part_numbers": ["MCB4370900C2", "02", "1"]
  },
  "general_product_information": {},
  "identifiers": {
    "version": 1,
    "identifiers": [
      {
        "type": "mpn",
        "value": "02",
        "region": "all"
      },
      {
        "type": "mpn",
        "value": "1",
        "region": "all"
      },
      {
        "type": "mpn",
        "value": "MCB4370900C2",
        "region": "all"
      }
    ],
    "retailer_listings": []
  }
}
