{
  "opendb_id": "0b069cbf-581a-4807-a373-1c5827f649fc",
  "connectivity": [],
  "lighting": [],
  "grip_types": [],
  "metadata": {
    "name": "Cooler Master CM Storm Recon Wired Optical Gaming Mouse",
    "manufacturer": "Cooler Master",
    "part_numbers": ["SGM-4001-WLLW1"]
  },
  "general_product_information": {},
  "identifiers": {
    "version": 1,
    "identifiers": [
      {
        "type": "mpn",
        "value": "SGM-4001-WLLW1",
        "region": "all"
      }
    ],
    "retailer_listings": []
  }
}
